{
  "$schema": "https://json-schema.org/draft/2020-12/schema",
  "$id": "https://mrbev02.github.io/klunk/schemas/profile.schema.json",
  "title": "Klunk paper profile",
  "description": "The rules for one kind of paper: how many sections, what each is worth, which question types belong in it. Everything a previous generation of this toolchain hardcoded lives here as data, so a new course is a file rather than a code change.",
  "type": "object",
  "required": ["formatVersion", "type", "id", "name", "paper"],
  "additionalProperties": false,

  "properties": {
    "formatVersion": { "const": "1" },
    "type": { "const": "klunk_profile" },

    "id": { "type": "string", "pattern": "^[a-z0-9]+(-[a-z0-9]+)*$" },
    "name": { "type": "string", "minLength": 1 },

    "syllabusId": {
      "type": "string",
      "description": "The syllabus model this profile assesses. Klunk uses it to offer the right topics when building a paper, and to report coverage."
    },

    "courseId": {
      "type": "string",
      "description": "Which course within that model, e.g. the Year 9 of a 7-10 syllabus, or SL of an IB one. A subject runs across several years and each year sets its own papers, so without this every year of a subject is one undifferentiated pool of questions. Absent means the profile assesses the whole model, which is what every profile written before this field meant and still means. Only meaningful alongside syllabusId: a bare course id could belong to any model in the folder."
    },

    "paper": {
      "type": "object",
      "required": ["totalMarks", "sections"],
      "additionalProperties": false,
      "properties": {
        "totalMarks": { "type": "number", "exclusiveMinimum": 0 },
        "readingMinutes": { "type": "number", "minimum": 0 },
        "workingMinutes": { "type": "number", "minimum": 0 },
        "instructions": {
          "type": "array",
          "description": "General instructions for the cover page, one per line.",
          "items": { "type": "string" }
        },
        "cover": {
          "type": "object",
          "description": "How this paper's cover sheet differs from the folder's school.json. The two real covers that shaped this share a skeleton and differ in exactly these two ways, plus whether a multiple choice answer sheet is printed at the back, so everything else stays in one place.",
          "additionalProperties": false,
          "properties": {
            "identification": {
              "type": "array",
              "description": "Overrides the folder's identification fields for this kind of paper. An external-style trial prints a student number grid where an internal exam prints Name and Class.",
              "items": { "$ref": "#/$defs/identificationField" }
            },
            "marksAwardedColumn": {
              "type": "boolean",
              "default": false,
              "description": "Print the marks breakdown as a Section / Marks Available / Marks Awarded table with a '/ N' cell per row for the marker, rather than as a list. Internal school exams do this and public examinations do not."
            },
            "answerSheet": {
              "type": "boolean",
              "default": false,
              "description": "Print a multiple choice answer sheet on its own page after the last question: the question numbers down the side, the option letters across the top, and the cover's identification fields at the head. The marking guide prints the same grid with the correct cells marked. Covers multiple_choice and multiple_response only, and prints nothing on a paper with neither."
            }
          }
        },

        "sections": {
          "type": "array",
          "minItems": 1,
          "items": { "$ref": "#/$defs/section" }
        }
      }
    },

    "questionTypes": {
      "type": "array",
      "description": "Types this course uses at all. Klunk hides every other type from the editor, which is how a Design and Technology teacher never sees an SQL question type.",
      "items": { "$ref": "#/$defs/questionType" }
    },

    "marks": {
      "type": "object",
      "additionalProperties": false,
      "properties": {
        "wholeNumberTotals": {
          "type": "boolean",
          "default": true,
          "description": "Whether each question's total must be a whole number. Part marks within a question are still allowed."
        },
        "partMarkGranularity": {
          "type": "number",
          "default": 0.5,
          "description": "Smallest allowed component mark, e.g. 0.5."
        }
      }
    },

    "print": {
      "type": "object",
      "description": "How the paper is laid out when printed. Klunk renders HTML and prints to PDF via the browser, so these map onto CSS.",
      "additionalProperties": false,
      "properties": {
        "paperSize": { "type": "string", "default": "A4" },
        "marginsMm": {
          "type": "array",
          "minItems": 4,
          "maxItems": 4,
          "items": { "type": "number", "minimum": 0 },
          "description": "Top, right, bottom, left."
        },
        "answerLineSpacingMm": {
          "type": "number",
          "description": "Spacing of ruled answer lines. Marks per line is the usual way schools size answer space."
        },
        "linesPerMark": {
          "type": "number",
          "description": "How much ruled space a mark earns, when the question does not say."
        }
      }
    }
  },

  "$defs": {
    "identificationField": {
      "type": "object",
      "required": ["label", "kind"],
      "additionalProperties": false,
      "description": "Duplicated verbatim from school.schema.json, which is where it is documented. Repeated rather than referenced because a cross-file $ref would need a registry the validation script does not build.",
      "properties": {
        "label": { "type": "string", "minLength": 1 },
        "kind": { "type": "string", "enum": ["write", "boxes"] },
        "boxes": { "type": "integer", "minimum": 1, "maximum": 20, "default": 8 },
        "onEveryPage": { "type": "boolean", "default": false }
      }
    },

    "questionType": {
      "type": "string",
      "description": "A closed list, and it grows only when a real examination prints a shape Klunk can print back. An open list would let a profile name a type nothing can render or mark, and a question that cannot print is worse than one that does not exist. Hiding types a course never sets is what 'questionTypes' below is for.",
      "enum": [
        "multiple_choice",
        "multiple_response",
        "matching",
        "true_false",
        "short_answer",
        "extended_response",
        "table",
        "drawing"
      ]
    },

    "section": {
      "type": "object",
      "required": ["id", "name", "marks"],
      "additionalProperties": false,
      "description": "Constraints are drawn from 11 years of real papers (2015-2025), so they distinguish what is genuinely fixed from what varies year to year.",
      "properties": {
        "id": { "type": "string", "minLength": 1 },
        "name": { "type": "string", "minLength": 1 },
        "marks": { "type": "number", "exclusiveMinimum": 0 },
        "suggestedMinutes": { "type": "number", "minimum": 0 },
        "instructions": { "type": "string" },

        "questionTypes": {
          "type": "array",
          "description": "Types permitted in this section.",
          "items": { "$ref": "#/$defs/questionType" }
        },

        "chooseCount": {
          "type": "integer",
          "minimum": 1,
          "description": "How many of this section's questions a student actually answers, where they are alternatives. The 2025 Visual Arts trial prints six 25-mark questions and says 'Attempt ONE question from Questions 4-9', so its Section II is chooseCount 1 of questionCount 6 and is worth 25. Absent means a student answers every question, which is what every section written before this field meant. Every alternative has to be worth the same, or the marks a student can earn would depend on which one they picked.",
          "default": null
        },

        "questionCount": {
          "type": "integer",
          "minimum": 1,
          "description": "Exact number of questions the section prints, where it always prints the same number. HSC Design and Technology Section I is always 10; Section III is always 1. In a choice section this is how many are offered, not how many are answered: see chooseCount."
        },
        "minQuestions": {
          "type": "integer",
          "minimum": 1,
          "description": "Use instead of questionCount where the count varies. Section II ran 2, 3 and 4 questions across 2015-2025, so pinning it to one number would reject valid papers."
        },
        "maxQuestions": { "type": "integer", "minimum": 1 },

        "marksPerQuestion": {
          "type": "number",
          "description": "Set where every question in the section is worth the same, e.g. 1 mark per objective-response question."
        }
      }
    }
  }
}
